{
  "$schema": "https://json-schema.org/draft/2020-12/schema",
  "$id": "https://scientificstate.org/schemas/module-store-entry.schema.json",
  "title": "ModuleStoreEntry",
  "type": "object",
  "required": ["module_id", "name", "version", "author_orcid", "signature", "status"],
  "properties": {
    "module_id": { "type": "string" },
    "name": { "type": "string" },
    "display_name": { "type": "string" },
    "version": { "type": "string", "pattern": "^\\d+\\.\\d+\\.\\d+$" },
    "description": { "type": "string" },
    "author_orcid": { "type": "string", "pattern": "^\\d{4}-\\d{4}-\\d{4}-\\d{3}[0-9X]$" },
    "signature": { "type": "string" },
    "tarball_hash": { "type": "string" },
    "status": { "enum": ["active", "deprecated", "revoked"] },
    "downloads": { "type": "integer", "minimum": 0 },
    "created_at": { "type": "string", "format": "date-time" },
    "updated_at": { "type": "string", "format": "date-time" }
  }
}
