{
  "module_id": "polymer_science_v010",
  "name": "polymer_science",
  "display_name": "Polymer Science",
  "version": "0.1.0",
  "description": "Polymer characterization and analysis domain",
  "author_orcid": "0000-0002-1825-0097",
  "signature": "a1b2c3d4e5f6a1b2c3d4e5f6a1b2c3d4e5f6a1b2c3d4e5f6a1b2c3d4e5f6a1b2",
  "tarball_hash": "e3b0c44298fc1c149afbf4c8996fb92427ae41e4649b934ca495991b7852b855",
  "status": "active",
  "downloads": 42,
  "created_at": "2026-04-03T12:00:00Z",
  "updated_at": "2026-04-03T12:00:00Z"
}
